{"deferred_features":["Complete profile container runners.","Native Windows profile execution.","Comprehensive DAST, general-purpose fuzzing, IAST, and runtime protection."],"documentation_coverage":"Strict machine catalogs map to curated documentation and reproducible generated reference tables.","experimental_features":["Portable container and auto mode availability beyond validated native combinations.","GitHub Enterprise Server integration."],"interface_statuses":{"conditionally_enforced":4,"deprecated":0,"experimental":1,"internal":0,"stable":23},"known_limitations":["Scanner coverage is incomplete and a clean result is not proof of security.","Complete native Minimal and Standard scanning is currently validated only on Linux x86_64.","Live Docker targets and GitHub OIDC signing require separately controlled environments.","Installed extension code and external agent behavior remain maintainer trust decisions."],"main_commit":"f19d5dcf29dc13b6b716d39bf11da1e31ca94234","migration_coverage":"Eleven representative paths cover v0.1.0, v0.2.0, current pre-v1, profiles, runtime add-ons, extensions, and agents.","platform_support":{"ghes.limitations":"experimental","github-hosted.ubuntu":"stable","linux-amd64":"stable","linux-arm64":"conditionally_enforced","macos-amd64":"conditionally_enforced","macos-arm64":"conditionally_enforced","self-hosted.runner-2.327.1":"stable","vibesec.compatibility.platforms":"stable","windows.native":"internal"},"release_artifact_verification":"Deterministic bundle, manifest, SBOM, readiness, provenance, checksum, tampering, and controlled signature paths are verified.","release_blockers":[],"schema_version":1,"schema_versions":{"agent_contract":1,"domain_catalog":1,"public_interface":1,"release_manifest":1,"release_readiness":1},"stable_id":"vibesec.release-readiness.v1","status":"ready_with_known_limitations","test_totals":{"automated_tests":406,"evidence":"full-local-suite-2026-07-25","machine_catalogs":14,"migration_paths":11},"threat_model_review":"Complete for documented v1 boundaries; residual risks are listed and no security guarantee is made.","unresolved_risks":["Live platform and third-party service behavior can differ from controlled offline tests.","Security scanners and maintained rules can miss vulnerabilities or report false positives."],"version":"1.0.0-dev"}
